{
  "schemaVersion": 1,
  "id": "vostride-docs",
  "name": "Vostride · Agent QA 文档",
  "vendor": "Vostride",
  "icon": "📚",
  "category": "开发工具",
  "summary": "搜索与阅读 Agent QA 公开文档",
  "description": "连接 Vostride 官方公开文档 MCP，搜索并阅读 Agent QA 的配置和工作流文档。此连接不执行本地 QA 测试、不读取用户仓库，也不需要模型密钥。查询会发送至 Vostride 服务，请勿包含凭据、个人信息或私有项目内容。当前为待审核草案，托管服务条款与 DSH 界面验收完成前不正式上架。",
  "tags": ["开发工具", "文档", "测试", "Agent QA", "免密"],
  "published": false,
  "featured": false,
  "homepage": "https://vostride.com/docs/agent-qa/mcp",
  "probeStatus": "unverified",
  "auth": { "mode": "none" },
  "servers": [{ "serverKey": "main", "serverName": "vostride-docs", "url": "https://vostride.com/mcp", "transport": "streamable-http" }],
  "prompts": [{ "title": "阅读 MCP 接入文档", "text": "仅使用 Vostride 文档 MCP 阅读 /docs/agent-qa/mcp，说明公开文档服务与本地 QA 执行的区别，附官方来源；不要执行测试、访问本地仓库或发送任何凭据。", "server": "main" }]
}
